Article Title,Comment
" Article Title: ""رايان إير"" تؤكد تحقيق أرباح قياسية",وفي نفس السياق شركة لارام المغربية التي تبيع تذاكرها بعشرة أضعاف او اكثر، على سبيل المثال تذكرة جنيف الدار البيضاء ب 700 فرنك سويسري او ايضا تذكرة نواكشوط الدار البيضاء ب 6000 درهم، مع ذلك لارام ليس لديها ارباح.
" Article Title: ""رايان إير"" تؤكد تحقيق أرباح قياسية",الفرق شاسع بين ريان اير ولارام في الاثمنة لأن اثمنة تذاكر لارام ليست في المستطاع حتى للغني فما بالك بالفقير اما ريان اير أثمن في المستوى بل حتى بعض الرحلات رخيصة جدا جدا بثمن 300 درهم ذهاب واياب .عندما يكون العامل نزيه تكون حساباته مضبوطة ولا تحتاج الشركة لمساعدة الدولة ….!
" Article Title: اجتماع تنسيقي ينزل ""تسعيرة البوطا""",الله اعز ايام زمان فاش كان حزب الاستقلال آنذاك حزبا له مبادء في عهد الملك الحسن الثاني رحمه الله،كانت المعيشة و الحياة لها قيمة و معنى وكانت المواد الاساسية متوفرة،اما الآن جاء اخناتوش كلا البلاد هو و تريكتوا او زايدينها بانهم حكومة تسعى لارضاء المواطن،هههه و لكن كما يقال “اذا اولية الامور لغير اهلها فانتظر الساعة”
" Article Title: اجتماع تنسيقي ينزل ""تسعيرة البوطا""",الله يرحم الوالدين لي فهم شي حاجة في هاد الاجتماع عوض ما يتكلمو على الزيادة في البوطة ، تكلمو على توفير الغاز المواطنين عطاكم الله باش ضحكو على شعب
" Article Title: اجتماع تنسيقي ينزل ""تسعيرة البوطا""",البوطة الكبيرة أصبحت ب 53 درهم مكان 40 درهم يعني تزادت 13 درهم
" Article Title: اجتماع تنسيقي ينزل ""تسعيرة البوطا""",خرجوا على البلاد مشات هادا هو قتل المواطن ببطء او بنفس باردة خلاصة
" Article Title: اجتماع تنسيقي ينزل ""تسعيرة البوطا""",يجب أن يتحرك الشعب لوقف هذا الهجوم على قدرته الشرائية المتدهورة أصلا. هل هذه هي الدولة الاجتماعية التي يتبجحون بها.
" Article Title: اجتماع تنسيقي ينزل ""تسعيرة البوطا""",كفى من الضحك على الدقون.حسبنا الله ونعم الوكيل فيكم.و عند ربكم تختصمون. و كفى بالله العلي العظيم شهيدا.
" Article Title: اجتماع تنسيقي ينزل ""تسعيرة البوطا""",سمعا و طاعة سيدنا صندوق النقذ الدولي. نحن ملتزمون معك و مستعدون لفعل أي شيء من أجل إرضائك و تنزيل تعليماتك بما فيها إفقار ما تبقى من الطبقة المتوسطة.نحن مستعدون للقضاء على دخلهم و القطاعات الاجتماعية و إثقال كاهلهم بالضرائب و بإغراقهم في الزيادات في الأسعار. فلتنم مرتاح البال سيدي صندوق النقذ الدولي.اللهم إن هذا لمنكر كبير.
" Article Title: اجتماع تنسيقي ينزل ""تسعيرة البوطا""",عندما كانت هناك أحزاب ونقابات وطنية لم تكن الحكومة تجرىء من الاقتراب من القدرة الشرائية للمواطن المغربي أما الآن فالساحة خالية لهم ليقوموا بما يحلوا لهم خدمة لمصالح شخصية وهذا يعني أن الشعب المغربي أصبح يتيما لا أحد الآن يدافع عنه أخشى على وطني ومستقبله من هؤلاء الموجودون حاليا
" Article Title: اجتماع تنسيقي ينزل ""تسعيرة البوطا""",أتمنى أن تكون الزيادة في أسعار غاز البوتان ب 10 دراهم ، سببا رئيسيا في توقف الطبقات الفقيرة والمتوسطة عن الإنجاب وتفريخ الأطفال لأن سبب أغلب المشاكل التي نعيشها ، من جريمة وبطالة و فساد أخلاقي هو العدد الهائل من الولادات في كل دقيقة .
" Article Title: اجتماع تنسيقي ينزل ""تسعيرة البوطا""",اللهم إن هذا لشيء كله مراوغة ،الذي يهلكنا هو غلاء المعيشة وارتفاع الأسعار، أما المواد فهي متوفرة على كل حال والمواطن احدب ظهره واثقل الغلا كهله، فهل من منقذ….
" Article Title: اجتماع تنسيقي ينزل ""تسعيرة البوطا""",بما ان الحكومة رفعت سعر البوطا بنسبة 20٪ سترتفع اسعار الخضر و الفواكه بإثرها بنسبة 20٪ لأن الفلاحة اصبحت تعتمد على البوطا في الآبارتستاهلوا ما كفس
 Article Title: النقل الجوي يزيد بـ30% في المملكة,لكن رغم ذالك تبقى الاسعار جد مرتفعة بين أمريكا الشمالية و المغرب!اغلى من امريكا لأماكن ابعد من المغرب كتركيامثلا.
 Article Title: النقل الجوي يزيد بـ30% في المملكة,يعني في السنة عدد المسافرين في مجموع مطارات المغرب 30 مليون. لما أرى مطار واحد في دول الغرب يصل عدد المسافرين عبره ضعف أو أكثر من 30 مليون. و أفعل مقارنة بين تكلفة هدا المطار بالغرب و عدد الموظفين و العمال به مع المبلغ الإجمالي لتكلفة جميع المطارات بالمغرب و عدد الموظفين و العمال بهم و النتيجة أن المردودية بمطارات المغرب صفر
 Article Title: صندوق الإيداع والتدبير يسند الاستثمار,استثمار للمنديال ولا زيادة للمتقاعدين مع ارتفاع الأسعار.
 Article Title: صندوق الإيداع والتدبير يسند الاستثمار,كل التمنيات بالتوفيق لإنجاح هذه المبادرة التي ستوفر العديد من مناصب الشغل للشباب المغربي
 Article Title: صندوق الإيداع والتدبير يسند الاستثمار,نتمنى لهاته الشراكة الإستراتيجية التوفيق والنجاح فإن CDG الدراع المالي للدولة و AMDIE الدراع الترويجي للدولة ان تعود بالنفع على الاقتصاد الوطني لخلق الثروة و مناصب الشغل لشبابنا العاطل دوي الكفاءات العالية، المغرب يسير في الإتجاه الصحيح و خاصة في مجال الاستثمار فهذا يثلج الصدور ويعطي الأمل الكبير في المستقبل ويعيد ثقة المستثمرين الأجانب في مؤسسات الدولة فهذا ما يوصي به دوماً صاحب الجلالة حفظه الله،
 Article Title: القضاء ينتصر لزبائن بشأن إغلاق حسابات بنكية واستخلاص مبالغ غير مستحقة,هناك بنوك تسرق من أموال الزبناء بحق وبدون حق.اقتطاعات غير مبررة. اختلاسات .
 Article Title: القضاء ينتصر لزبائن بشأن إغلاق حسابات بنكية واستخلاص مبالغ غير مستحقة,للأسف الشديد لم أكن أعرف ماذا أفعل لأن مؤسسة بنكية كنت أتعامل معهم على أساس نقود الضمان الإجتماعي نصبو علي بتفعيل حسابين لمدة ثلاث أو أربع سنوات وفي الأخير أخذو مني ما تبقا من حسابي وفرضو علي اداء رمزي عبارة عن خمسة دراهم زائد ما أخذو مني بدون وجه حق في مدينة مكناس وللإشارة هذه الشركة الكل يشتكي من تعامل موضفيها وكذلك النصب على من يكون فريسة سهلة لهم ربي ياخذ فيهم الحق وبالمقابل أي واحد أعرفه أحذره من التعامل معهم .
 Article Title: القضاء ينتصر لزبائن بشأن إغلاق حسابات بنكية واستخلاص مبالغ غير مستحقة,هادشي سميتو السرقة بالعيلاني و الواعرة كيبقاو ايبيعو ليك اي حاجا داروها جديدة فالبانكا بطاقات تامينات ويقتاطعو ليك و خا لحساب عندك فيه صفر درهم حتا كيوليو ايسالوك هوما ألف درهم و يحسبو عليق الفوائد التاخير و ها هي ولات خمسة آلاف درهم و فالاخير يبقاو ايهددوك بالمحامي ديالهم
 Article Title: القضاء ينتصر لزبائن بشأن إغلاق حسابات بنكية واستخلاص مبالغ غير مستحقة,لصوص بكل ما للكلمة من معنى.. نقطة الى السطر
 Article Title: القضاء ينتصر لزبائن بشأن إغلاق حسابات بنكية واستخلاص مبالغ غير مستحقة,ومع ذالك يهرعون بالليل والنهار لسحب الكاش حتى تصبح عبدا للبنك يتحكم في امولك وتدفع ثمن الخدمة بالقوة على كل عملية بنكية وهم كن يحدد الثمن ويتحكم في رزقك ولا احد يستطيع الوقوف في وجههم .
 Article Title: القضاء ينتصر لزبائن بشأن إغلاق حسابات بنكية واستخلاص مبالغ غير مستحقة,رغم أنني قفلت حسابي البنكي .وبعد مرور الوقت تراكمت علي 1560 درهم . نعم أديتها للبنك ضلما وعدونا .
 Article Title: القضاء ينتصر لزبائن بشأن إغلاق حسابات بنكية واستخلاص مبالغ غير مستحقة,ليست لدينا مواصفات للعمل بمنطق التحرير أو أساليب العولمة . تناقض صارخ بين الخطاب و الممارسة و ما بالكم عن الإحتكار و تضارب المصالح كتمثبلية في حماة المستهلك و ممثل معين في مجلس . مفارقات غائبة لكن غفلة تابى إلا ان تظهرها . عموما تعليقنا وقع سواء ظهر ام حجب قد صدر.
 Article Title: القضاء ينتصر لزبائن بشأن إغلاق حسابات بنكية واستخلاص مبالغ غير مستحقة,و هل يوما دهبنا الي البنك من أجل الاستفسار؟؟ بالطبع لا ثم لا : حاول بنك اتعامل معه بفرض اقتطاعات التأمين، لكن حينما رفضت ، و بسرعة لم يعد هناك الا مستحقات البنك : لابد من تتبع حالتك البنكية، و الحمد لله الامور الان أصبحت سهلة، الا لمن لا يريد الحساب الرقمي مجاني يعطيك كل ما جد في حسابك ، و حينما ترى خللا الاتصال مباشرة او الدهاب الي البنك و ستجد ادانا صاغية : لابد لنا جميعا ان نتحد في كلما يفيد وطننا :مساعدة الرجال النزهاء، لأن لا أحد لا يخطأ ، و نوقف المتلاعبين عند حدهم، ليس ب الشتم و السب ، ابدا لا : الدخول عند الرئيس، و هناك رئيس فوقه، و لكن انا على يقين ان مشكل التواصل هو من يخلق هذه المشاكل
 Article Title: القضاء ينتصر لزبائن بشأن إغلاق حسابات بنكية واستخلاص مبالغ غير مستحقة,لا اعمم ولكن اغلب الابناك ينهبون الزبائن بدون حقالحساب اذا لم يستعمل من طرف صاحبه لمدة 6 اشهر يجب اغلاقه اطوماتيكيا… ولكنهم يستمرون في زيادة المصاريف علي الزبون بدون حق… لهاذا يجب الاتجاه الى القضاء…والحمد لله العدالة نزيهة وتنتصر للمظلوم…
 Article Title: القضاء ينتصر لزبائن بشأن إغلاق حسابات بنكية واستخلاص مبالغ غير مستحقة,القانون واضح تماما.كل حساب لا يتحرك لمدة معينة يغلق تلقائيا من طرف البنك. والغريب ان بعض الزبائن طلب غلق حسابه وسلمت له نسخة من اشعار الاغلاق وبعد مدة توصل ياشعار يطالب فيه بادء مبلغ يتعلق بمصاريف مسك الحساب. ولولا توفره على اشعار الغلق لكان ملزما بالاداء ظلما ونصبا… يستغرب الانسان لما يجد البنك يستعمل وسائل الاحتيال والمفروض فيه ان يكون امينا.
 Article Title: القضاء ينتصر لزبائن بشأن إغلاق حسابات بنكية واستخلاص مبالغ غير مستحقة,البنك يخدم لك بفلوسك وفلوس عمالنا في الخارج في الدول الافريقية ، وتمويل المشاريع العقارية والصناعية الضخمة باموال الناس، ولا يعطيهم سنتيم من اموالهم التي يستخدمها، و على العكس من ذلك يأخذ عمولة على المعاملات بين الابناك، وعند اي نشاط داخل التطبيق او داخل البنك او باستخدام صناديق السحب، واذا اردت اغلاق حسابك يمنعك من ذلك و يفرض عليك رسوم وفوائد وغرامات، ويعمل بمبدأ j+1 و j-1 لاخد اموال الناس دون الشرح لهم، الخلاصة طالع واكل نازل واكل
 Article Title: القضاء ينتصر لزبائن بشأن إغلاق حسابات بنكية واستخلاص مبالغ غير مستحقة,بعض الابناك وللاسف داءما تلتهم من حسابات الزباءن في حالة وجود رصيد.وفي حالة بدون رصيد تبقى كدلك تحسب زيادات دون توقف ولو ان الزبون لم يعد يستعمل دلك الحساب لمدة لسبب من الاسباب كالتوقف عن العمل او او ….هدا هو السبب في عزوف الناس عن استعمال الابناك وتفضيل الاحتفاظ بنقوده في المنزل او غيره وبالتالي التعامل بالكاش بدل الدفع بالشيك او ما شابه.
 Article Title: القضاء ينتصر لزبائن بشأن إغلاق حسابات بنكية واستخلاص مبالغ غير مستحقة,اناخلصت 3500dh قلولي كنسلوهلك .وكنت سديت لحسب وهما لمسدوهش.دعهم الله
" Article Title: ""المالية"" تدقق في اختلالات استخلاص ""غرامات تأخير"" خلال تدبير صفقات عمومية",النسيج المقاولاتي في قطاع البناء والأشغال العمومية يلزمه اعادة نظر عميقة، المقاول المغربي تنقصه الجدية والأخلاقيات وأحد الأدلة على ذالك هيمنة مقاولات إفرنجية الهوية ظلماً على القطاع، والمرجو تكثيف مثل هته الإجراءات الإفتحاصية لكشف اللوبيات ومحاصرة سماسرة الصفقات العمومية املا في الرقي بممارسات تدبير المشاريع وانبعاث جيل جديد من المقاولين في مستوى التحديات وتطلعات المغاربة ..
" Article Title: ""المالية"" تدقق في اختلالات استخلاص ""غرامات تأخير"" خلال تدبير صفقات عمومية",وشهد شاهد من اهلها.الإدارة تجد الاعذار لمن تريد متى تريد هناك مجموعة من المشاريع التي التعاقد مع مقاولات تم تصنيفها في دراجة اعلى بكثير من تصنيفها الائتماني و تحصل على مناقصات تفوق طاقتها الحقيقة (مع الدليل و البرهان) .تبادر الى دهني مثال مقاول دخل في منازعات مع الإدارة حول مشروع غرفة الصناعة التقليدية وفي نفس السنة شارك في مناقصة همت بناء المسرح البلادي غياثة وحصل على المشروع و كالعادة اعلن افلاسه دون آي مركب نقص … نفس المسؤول الذي يتفاض معه عن الفشل الاول هو من صادق على الصفقة التانية.
" Article Title: ""المالية"" تدقق في اختلالات استخلاص ""غرامات تأخير"" خلال تدبير صفقات عمومية",من بين المشاريع المغشوشة والتي لم تر الوجود هي المحطة الطرقية لمدينة الجديدة. التي أنجزت ميزانية خيالية وعلى أرض صغيرة ليست الأرض المعينة لها في بداية المشروع وهي لا تحترم معايير محطة طرقية. لقد تلاعب رئيس مجلس البلدي لمدينة الجديدة السيد بن ربيعة واعوانه بالأرض والميزانية المحولة للمحطة. والي يومنا هذا لم تفتح لان فيها خلل فضيع.يجب محاسبة كل المسؤولين على المشروع بما فيهم رئيس مجلس البلدي بن ربيعة الذي ينتمي لحزب الاستقلال.
" Article Title: ""المالية"" تدقق في اختلالات استخلاص ""غرامات تأخير"" خلال تدبير صفقات عمومية",لا يمر الاسبوع دون الحديث عن الاختلاسات والنهب والصفقات العمومية المشبوهة . فالى متى سيستمر هذا الوضع المخيف…لابد من وضع حد لهذا النزيف الذي يعرقل اي تقدم للبلاد.
" Article Title: ""المالية"" تدقق في اختلالات استخلاص ""غرامات تأخير"" خلال تدبير صفقات عمومية",جدتي عمرها68 عاما ليس لها معين و ليس لها تغطية اجتماعية و ليس لها تقاعد كانت تتوفر على راميد استغلته لاجراء عملية الجلالة….في شهر يناير و فبراير توصلت بمبلغ500درهم و ابتداء من شهر مارس تم حرمانها من الدعم بداعي ارتفاع المؤشر لانها عبات 20درهم في الهاتف و الان لا راميد لا دعم و لا حول و لا قوة الا بالله….
" Article Title: الزيادات الجديدة في أسعار ""البوطاغاز"" تستنفر مهنيي المقاهي والمطاعم",اصلا المقاهي عاد زادو فالتمن راه دبا حتى المجالاات اللي متتستعملش فيها البوطا زادو فالتمن بحال السيما الحديد الافرشة كلشي تزاد فالتمن والسبب بوطا تانيا شنو مصير الاسر اللي ماخداش الدعم بسبب المؤشر شنو مصري الافااد كبار السن والمعاقين الارامل والاشخاص غير المتزوجين ولا عائلة لهم وفقراء او مرضى او معاقين والمؤشر عندهوم طالع ؟
" Article Title: الزيادات الجديدة في أسعار ""البوطاغاز"" تستنفر مهنيي المقاهي والمطاعم",إلى كان غير القهاوي غير زيدو مع راستكمالبشر بدل من ان يكون نافعا يقضي وقته اليوم كامل في المقهى
" Article Title: الزيادات الجديدة في أسعار ""البوطاغاز"" تستنفر مهنيي المقاهي والمطاعم",إوا فكها يمن وحلها الزيادة في البوطة تخلي وراها العافية شاعلة في جميع المواد الغذائية الله ياخذ فيكم الحقخودو العبرة من الرئيس الايراني ومسؤولين معاه في الحكومة راحو ضحية حادث الطائرة التي سقطت بهمالله ياخذ فيكم الحق
" Article Title: الزيادات الجديدة في أسعار ""البوطاغاز"" تستنفر مهنيي المقاهي والمطاعم",ان تجرأت الحكومة على الزيادة في مادة اساسية وبدون رضى ولا مراعاة للوضع الاجتماعي المتردي، فاين كرامة المواطن في جودة الصحة التعليم القضاء مراقبة المال العام ووو .اظن اننا نسير في اتجاه حاجز مسدود
" Article Title: الزيادات الجديدة في أسعار ""البوطاغاز"" تستنفر مهنيي المقاهي والمطاعم",جا الوقت باش نقولو الاحفاد “في وقتنا كانت القهوة غا 7 دراهم والبوطة غير 40 درهم “
" Article Title: الزيادات الجديدة في أسعار ""البوطاغاز"" تستنفر مهنيي المقاهي والمطاعم",اختيار وقت غير مناسب .كان على حكومة أخنوش أن تتنظر حتى يمر عيد الأضحى المبارك لان الشعب في حيرة من أمره مع الغلاء الفاحش في كل الأسعار.اللهم الطف بنا في ما جرت به المقادير.
" Article Title: الزيادات الجديدة في أسعار ""البوطاغاز"" تستنفر مهنيي المقاهي والمطاعم",واش أصحاب المقاهي والمطاعم والمخابز وكل من يستعمل الغاز يعلمون ثمن الغاز في المانيا فرنسا وأسعار المانيا وفرنسا مقارنات مع المغرب اسعار القهوة في المغرب تقارب أسعارها في أوروبا بل العديد من المقاهي في مراكش طنجة الدارالبيضاء المطارات في المغرب اكثر من ثمن القهوة في باريس وفرانكفورت ثمن القهوة في خمس نجوم فنادق الشانزيليزي والشوارع المرتبطة به 5يورو و3.50 كاملة قهوة في المغرب هناك مقاهي غير مصنفة من 30الى 70درهم
" Article Title: الزيادات الجديدة في أسعار ""البوطاغاز"" تستنفر مهنيي المقاهي والمطاعم",توقيت جد سيء للزيادة…الغلاء هلك المواطنين…اللحم فاق 130 درهم للكيلو…زيت الزيتون 110 درهم…المازوط 13 درهم…كارثة…الشعب يعاني…الطبقة المتوسطة عاجزة عن أكل اللحم…الغلاء في كل شيء وفي أي شيء…هذه الزيادة سيكون لها أثر خطير…
" Article Title: الزيادات الجديدة في أسعار ""البوطاغاز"" تستنفر مهنيي المقاهي والمطاعم",لبوطا توصل حتال 100 درهم و دايزا ، حيت قليل باش كنبدلوها
" Article Title: الزيادات الجديدة في أسعار ""البوطاغاز"" تستنفر مهنيي المقاهي والمطاعم",ياربي السلاما هاهوما قالو وجدنا الغاز في العرائش أوزادونا فالبوطا عاوتاني إلى لقاو البترول إيزيدو لينا فالمازوط الله إلطف بينا
" Article Title: الزيادات الجديدة في أسعار ""البوطاغاز"" تستنفر مهنيي المقاهي والمطاعم",زيادة 10 دراهم في ثمن قنينة غاز يعني زيادة 25 في المائة يعني زيادة في قيمة الخضر و الفواكه نسبتها 25 في المائة يعني من يشتري قفة أسبوعية ب200 درهم سترتفع إلى 250 درهم وهكذااذن هناك تأثير على غالبية القطاعات الغدائيةالمشكلة الكبرى عند نهاية هذه الزيادات يعني حينما يصل ثمن القنينة 100 درهم حينها نسأل الله اللطف
" Article Title: الزيادات الجديدة في أسعار ""البوطاغاز"" تستنفر مهنيي المقاهي والمطاعم",الأفرنة والمقلهي والفنادق والضيعات ومصانع تدويب المعادن خاصة المسروقة كلها تستعمل العشرات من قنينات الغاز المدعم. فاعرف بعض الوحدات الإنتاجية للخبز تستقبل شاحنة قنينات كل أسبوعين والحي كله يستهلك شاحنة في الشهر.
